Event,Type,Mode,Date,Fee,Priority,Source,Register,LastUpdated
IndiaAI Government AI Program,Government,Online,10-Jul-2026,Free,High,IndiaAI,https://indiaai.gov.in,06-Jun-2026 18:20:00
MeitY Digital India AI Workshop,Government,Online,15-Jul-2026,Free,High,MeitY,https://www.meity.gov.in,06-Jun-2026 18:20:00
Google Developer AI Webinar,Workshop,Online,20-Jul-2026,Free,Medium,Google,https://developers.google.com/events,06-Jun-2026 18:20:00
NASSCOM FutureSkills AI Session,Workshop,Online,25-Jul-2026,Free,Medium,NASSCOM,https://futureskillsprime.in,06-Jun-2026 18:20:00
Global Agentic AI Hackathon,Hackathon,Online,30-Jul-2026,Free,High,Devpost,https://devpost.com,06-Jun-2026 18:20:00
IndiaAI GenAI Innovation Summit,Government,Hybrid,20-Jul-2026,Free,High,IndiaAI,https://indiaai.gov.in,06-Jun-2026 18:31:54
Digital India AI Conference,Government,Hybrid,28-Jul-2026,Free,High,MeitY,https://www.meity.gov.in,06-Jun-2026 18:39:12
Google Cloud AI Webinar,Workshop,Online,20-Jul-2026,Free,Medium,Google,https://developers.google.com/events,06-Jun-2026 18:44:26
Gemini Developer Workshop,Workshop,Online,28-Jul-2026,Free,High,Google,https://developers.google.com/events,06-Jun-2026 18:44:26
NASSCOM GenAI Session,Workshop,Online,25-Jul-2026,Free,Medium,NASSCOM,https://futureskillsprime.in,06-Jun-2026 18:44:26
FutureSkills AI Career Event,Workshop,Online,29-Jul-2026,Free,High,NASSCOM,https://futureskillsprime.in,06-Jun-2026 18:44:26
Microsoft AI Developer Day,Workshop,Online,05-Aug-2026,Free,High,Microsoft,https://learn.microsoft.com/events/,06-Jun-2026 20:20:28
Microsoft Azure AI Webinar,Workshop,Online,12-Aug-2026,Free,Medium,Microsoft,https://learn.microsoft.com/events/,06-Jun-2026 20:20:28
NVIDIA AI Developer Summit,Workshop,Online,18-Aug-2026,Free,High,NVIDIA,https://www.nvidia.com/en-us/events/,06-Jun-2026 20:20:28
NVIDIA Generative AI Session,Workshop,Online,25-Aug-2026,Free,High,NVIDIA,https://www.nvidia.com/en-us/events/,06-Jun-2026 20:20:28
OpenAI Developer Conference,Workshop,Online,10-Sep-2026,Free,High,OpenAI,https://openai.com,06-Jun-2026 20:20:28
OpenAI Agents Workshop,Workshop,Online,15-Sep-2026,Free,High,OpenAI,https://openai.com,06-Jun-2026 20:20:28
AWS Generative AI Builders Workshop,Workshop,Online,20-Sep-2026,Free,High,AWS,https://aws.amazon.com/events/,06-Jun-2026 20:40:49
AWS AI and Machine Learning Webinar,Workshop,Online,28-Sep-2026,Free,Medium,AWS,https://aws.amazon.com/events/,06-Jun-2026 20:40:49
AWS Live Events Portal,Workshop,Online,Live,Check Website,High,AWS,https://aws.amazon.com/events/,06-Jun-2026 21:12:13
AWS GenAI Executive Summit TEST,Workshop,Online,15-Aug-2026,Free,High,AWS,https://aws.amazon.com/events/,06-Jun-2026 21:59:24
AWS Events Portal,Workshop,Online,Live,Check Website,High,AWS,https://aws.amazon.com/events/,06-Jun-2026 23:32:21
AWS Event: Skip to main content,Workshop,Online,Live,Check Website,Medium,AWS,https://aws.amazon.com/events/,06-Jun-2026 23:32:21
AWS Event: AWS Marketplace,Workshop,Online,Live,Check Website,Medium,AWS,https://aws.amazon.com/events/,06-Jun-2026 23:32:21
AWS Event: Sign in to console,Workshop,Online,Live,Check Website,Medium,AWS,https://aws.amazon.com/events/,06-Jun-2026 23:32:21
AWS Event: Create account,Workshop,Online,Live,Check Website,Medium,AWS,https://aws.amazon.com/events/,06-Jun-2026 23:32:21
AWS Event: Explore events,Workshop,Online,Live,Check Website,Medium,AWS,https://aws.amazon.com/events/,06-Jun-2026 23:32:21
AWS Event: Events content,Workshop,Online,Live,Check Website,Medium,AWS,https://aws.amazon.com/events/,06-Jun-2026 23:32:21
AWS Event: View upcoming events,Workshop,Online,Live,Check Website,Medium,AWS,https://aws.amazon.com/events/,06-Jun-2026 23:32:21
AWS Event: Watch the highlights,Workshop,Online,Live,Check Website,Medium,AWS,https://aws.amazon.com/events/,06-Jun-2026 23:32:21
AWS Event: View upcoming AWS Summits,Workshop,Online,Live,Check Website,Medium,AWS,https://aws.amazon.com/events/,06-Jun-2026 23:32:21
AWS Event: Save the date,Workshop,Online,Live,Check Website,Medium,AWS,https://aws.amazon.com/events/,06-Jun-2026 23:32:21
Google Developers Events Portal,Workshop,Online,Live,Check Website,High,Google,https://developers.google.com/events,06-Jun-2026 23:35:38
Google Event: Skip to main content,Workshop,Online,Live,Check Website,Medium,Google,https://developers.google.com/events,06-Jun-2026 23:35:38
Google Event: Google for Developers,Workshop,Online,Live,Check Website,Medium,Google,https://developers.google.com/,06-Jun-2026 23:35:38
Google Event: APAC Google Cloud Labs: OnAir,Workshop,Online,Live,Check Website,Medium,Google,https://cloud.google.com/resources/apac-labs-onair?utm_campaign=FY26-Q2-apac-APA40553-operational-er-apac_labs_onair_hub_website&utm_medium=et&utm_source=dgc-site&utm_content=apac-labs-onair-hub-global_dev_event_web&utm_term=-,06-Jun-2026 23:35:38
Google Event: #GoogleCloud,Workshop,Online,Live,Check Website,Medium,Google,https://twitter.com/search?q=%23GoogleCloud,06-Jun-2026 23:35:38
"Google Event: Gen AI Academy, APAC | 180K+ developers onboard",Workshop,Online,Live,Check Website,Medium,Google,https://vision.hack2skill.com/event/apac-genaiacademy?utm_source=GFD_web&utm_medium=google,06-Jun-2026 23:35:38
Google Event: #GenAIAcademy,Workshop,Online,Live,Check Website,Medium,Google,https://twitter.com/search?q=%23GenAIAcademy,06-Jun-2026 23:35:38
Google Event: Google Cloud Summit DACH,Workshop,Online,Live,Check Website,Medium,Google,https://cloud.google.com/events/summit-dach-2026-developer?utm_source=gc_events&utm_medium=display&utm_content=googlefordev_event&utm_campaign=FY26-Q2-EMEA-GLO396484-physicalevent-er-summit-frk-dev-164834,06-Jun-2026 23:35:38
Microsoft Events Portal,Workshop,Online,Live,Check Website,High,Microsoft,https://learn.microsoft.com/events/,06-Jun-2026 23:39:29
Microsoft Event: Skip to main content,Workshop,Online,Live,Check Website,Medium,Microsoft,https://learn.microsoft.com/events/,06-Jun-2026 23:39:29
Microsoft Event: Copilot Learning Hub,Workshop,Online,Live,Check Website,Medium,Microsoft,https://learn.microsoft.com/en-us/shows/copilot-learning-hub,06-Jun-2026 23:39:29
Microsoft Event: Azure Essentials Show,Workshop,Online,Live,Check Website,Medium,Microsoft,https://learn.microsoft.com/en-us/shows/azure-essentials-show,06-Jun-2026 23:39:29
Microsoft Event: Mastering Copilot Studio,Workshop,Online,Live,Check Website,Medium,Microsoft,https://learn.microsoft.com/en-us/shows/mastering-copilot-studio,06-Jun-2026 23:39:29
Microsoft Event: RAG Time: AI Learning,Workshop,Online,Live,Check Website,Medium,Microsoft,https://learn.microsoft.com/en-us/shows/rag-time-ai-learning,06-Jun-2026 23:39:29
Microsoft Event: Multimodal data processing with Azure AI Content Understanding,Workshop,Online,Live,Check Website,Medium,Microsoft,https://learn.microsoft.com/en-us/shows/multimodal-data-processing-with-azure-ai-content-understanding,06-Jun-2026 23:39:29
Microsoft Event: AI Agents for Beginners,Workshop,Online,Live,Check Website,Medium,Microsoft,https://learn.microsoft.com/en-us/shows/ai-agents-for-beginners,06-Jun-2026 23:39:29
Microsoft Event: GitHub Copilot Bootcamp,Workshop,Online,Live,Check Website,Medium,Microsoft,https://learn.microsoft.com/en-us/shows/github-copilot-bootcamp,06-Jun-2026 23:39:29
Microsoft Event: Azure Developers - SQL Conf() 2025,Workshop,Online,Live,Check Website,Medium,Microsoft,https://learn.microsoft.com/en-us/shows/azure-developers-sql-conf-2025,06-Jun-2026 23:39:29
Microsoft Event: AI Disclaimer,Workshop,Online,Live,Check Website,Medium,Microsoft,https://learn.microsoft.com/en-us/principles-for-ai-generated-content,06-Jun-2026 23:39:29
NVIDIA Events Portal,Workshop,Online,Live,Check Website,High,NVIDIA,https://www.nvidia.com/en-us/events/,06-Jun-2026 23:40:34
NVIDIA Event: Skip to main content,Workshop,Online,Live,Check Website,Medium,NVIDIA,https://www.nvidia.com/en-us/events/,06-Jun-2026 23:40:34
NVIDIA Event: DGX CloudNVIDIA’s AI factory in the cloud,Workshop,Online,Live,Check Website,Medium,NVIDIA,https://www.nvidia.com/en-us/data-center/dgx-cloud/,06-Jun-2026 23:40:34
"NVIDIA Event: NVIDIA APIsExplore, test, and deploy AI models and agents",Workshop,Online,Live,Check Website,Medium,NVIDIA,https://build.nvidia.com/,06-Jun-2026 23:40:34
"NVIDIA Event: NVIDIA NGCAccelerated, containerized AI models and SDKs",Workshop,Online,Live,Check Website,Medium,NVIDIA,https://www.nvidia.com/en-us/gpu-cloud/,06-Jun-2026 23:40:34
NVIDIA Event: DSX PlatformBuild AI factories optimized for lowest cost tokens per megawatt,Workshop,Online,Live,Check Website,Medium,NVIDIA,https://www.nvidia.com/en-us/data-center/products/dsx/,06-Jun-2026 23:40:34
"NVIDIA Event: NVIDIA Broadcast AppAI-enhanced voice and video for next-level streams, videos, and calls",Workshop,Online,Live,Check Website,Medium,NVIDIA,https://www.nvidia.com/en-us/geforce/broadcasting/,06-Jun-2026 23:40:34
"NVIDIA Event: NVIDIA App and Studio DriversOptimize gaming, streaming, and AI-powered creativity",Workshop,Online,Live,Check Website,Medium,NVIDIA,https://www.nvidia.com/en-us/software/nvidia-app/,06-Jun-2026 23:40:34
"NVIDIA Event: RTX AI PCsAI PCs for gaming, creating, productivity and development",Workshop,Online,Live,Check Website,Medium,NVIDIA,https://www.nvidia.com/en-us/ai-on-rtx/,06-Jun-2026 23:40:34
NVIDIA Event: RTX RemixCreate RTX remasters of classic games with open-source AI,Workshop,Online,Live,Check Website,Medium,NVIDIA,https://www.nvidia.com/en-us/geforce/rtx-remix/,06-Jun-2026 23:40:34
NVIDIA Event: Project G-AssistAI assistant to optimize and control your GeForce RTX PC,Workshop,Online,Live,Check Website,Medium,NVIDIA,https://www.nvidia.com/en-us/software/nvidia-app/g-assist/,06-Jun-2026 23:40:34
OpenAI Website Unavailable,Workshop,Online,Unknown,Unknown,Medium,OpenAI,https://openai.com/news/,06-Jun-2026 23:41:45
Devpost Hackathons Portal,Hackathon,Online,Live,Check Website,High,Devpost,https://devpost.com/hackathons,06-Jun-2026 23:42:57
Devpost Hackathon: Join a hackathon,Hackathon,Online,Live,Check Website,High,Devpost,https://devpost.com/hackathons,06-Jun-2026 23:42:57
Devpost Hackathon: DevpostParticipate in our public hackathons,Hackathon,Online,Live,Check Website,High,Devpost,https://devpost.com/hackathons,06-Jun-2026 23:42:57
Devpost Hackathon: Devpost for TeamsAccess your company's private hackathons,Hackathon,Online,Live,Check Website,High,Devpost,https://devpost.team,06-Jun-2026 23:42:57
Devpost Hackathon: Host a hackathon,Hackathon,Online,Live,Check Website,High,Devpost,https://devpost.com/hackathons,06-Jun-2026 23:42:57
Devpost Hackathon: DevpostGrow your developer ecosystem and promote your platform,Hackathon,Online,Live,Check Website,High,Devpost,https://info.devpost.com/product/public-hackathons,06-Jun-2026 23:42:57
Devpost Hackathon: Host a public hackathon,Hackathon,Online,Live,Check Website,High,Devpost,https://info.devpost.com/product/public-hackathons,06-Jun-2026 23:42:57
"Devpost Hackathon: Devpost for TeamsDrive innovation, collaboration, and retention within your organization",Hackathon,Online,Live,Check Website,High,Devpost,https://info.devpost.com/product/devpost-for-teams,06-Jun-2026 23:42:57
Devpost Hackathon: Host an internal hackathon,Hackathon,Online,Live,Check Website,High,Devpost,https://info.devpost.com/product/devpost-for-teams,06-Jun-2026 23:42:57
Devpost Hackathon: AI hackathons,Hackathon,Online,Live,Check Website,High,Devpost,https://info.devpost.com/product/ai-hackathons,06-Jun-2026 23:42:57
Devpost Hackathon: Customer hackathons,Hackathon,Online,Live,Check Website,High,Devpost,https://info.devpost.com/product/customer-hackathons,06-Jun-2026 23:42:57
NASSCOM Events Portal,Workshop,Online,Live,Check Website,High,NASSCOM,https://nasscom.in/events,06-Jun-2026 23:44:05
NASSCOM Event: Membership Details,Workshop,Online,Live,Check Website,Medium,NASSCOM,https://nasscom.in/membership,06-Jun-2026 23:44:05
NASSCOM Event: GenAI Talent Imperative: Building Global Future Workforce,Workshop,Online,Live,Check Website,Medium,NASSCOM,https://nasscom.in/events/genai-talent-imperative-building-global-future-workforce,06-Jun-2026 23:44:05
NASSCOM Event: AI x Creativity: Skilling for Innovation Intelligent Economy,Workshop,Online,Live,Check Website,Medium,NASSCOM,https://nasscom.in/events/ai-x-creativity-skilling-innovation-intelligent-economy,06-Jun-2026 23:44:05
NASSCOM Event: Pathways for EU–India AI Skills and Talent Mobility,Workshop,Online,Live,Check Website,Medium,NASSCOM,https://nasscom.in/events/pathways-eu-india-ai-skills-and-talent-mobility,06-Jun-2026 23:44:05
NASSCOM Event: Building Bridges through AI: India and Germany,Workshop,Online,Live,Check Website,Medium,NASSCOM,https://nasscom.in/events/building-bridges-through-ai-india-and-germany,06-Jun-2026 23:44:05
"NASSCOM Event: Sovereign AI for India: Designing the Nation’s Future Compute, Data and Innovation Ecosystem",Workshop,Online,Live,Check Website,Medium,NASSCOM,https://nasscom.in/events/sovereign-ai-india-designing-nations-future-compute-data-and-innovation-ecosystem,06-Jun-2026 23:44:05
NASSCOM Event: AI and Workforce Transformation: India's Roadmap to Global Competitiveness,Workshop,Online,Live,Check Website,Medium,NASSCOM,https://nasscom.in/events/ai-and-workforce-transformation-indias-roadmap-global-competitiveness,06-Jun-2026 23:44:05
"NASSCOM Event: AI at the Core, 6G at the Edge: Designing India’s Next Resilient, Innovative, and Efficient…",Workshop,Online,Live,Check Website,Medium,NASSCOM,https://nasscom.in/events/ai-core-6g-edge-designing-indias-next-resilient-innovative-and-efficient-digital-frontier,06-Jun-2026 23:44:05
NASSCOM Event: Innovating Together: Harnessing Open-Source AI for Inclusive Economic Development,Workshop,Online,Live,Check Website,Medium,NASSCOM,https://nasscom.in/events/innovating-together-harnessing-open-source-ai-inclusive-economic-development,06-Jun-2026 23:44:05
IndiaAI Events Portal,Government,Online,Live,Check Website,High,IndiaAI,https://indiaai.gov.in/events,06-Jun-2026 23:45:13
IndiaAI Event: IndiaAI Portal,Government,Online,Live,Check Website,High,IndiaAI,https://indiaai.gov.in/indiaaiportal,06-Jun-2026 23:45:13
IndiaAI Event: ArticlesIn-depth and nuanced coverage of leading trends in AI,Government,Online,Live,Check Website,High,IndiaAI,https://indiaai.gov.in/articles,06-Jun-2026 23:45:13
IndiaAI Event: Research ReportsA collection of the most relevant and critical research in AI today,Government,Online,Live,Check Website,High,IndiaAI,https://indiaai.gov.in/research-reports,06-Jun-2026 23:45:13
IndiaAI Event: VideosThe best of AI brought to you in bite-sized videos,Government,Online,Live,Check Website,High,IndiaAI,https://indiaai.gov.in/videos,06-Jun-2026 23:45:13
IndiaAI Event: NewsLatest updates on developments in the AI world,Government,Online,Live,Check Website,High,IndiaAI,https://indiaai.gov.in/news,06-Jun-2026 23:45:13
IndiaAI Event: Case StudiesRead the latest case studies in the field of AI,Government,Online,Live,Check Website,High,IndiaAI,https://indiaai.gov.in/case-studies,06-Jun-2026 23:45:13
IndiaAI Event: AI StandardsWorld-class policy developments and accepted standards in AI development,Government,Online,Live,Check Website,High,IndiaAI,https://indiaai.gov.in/ai-standards,06-Jun-2026 23:45:13
IndiaAI Event: LearningA collection of top courses in the field of AI,Government,Online,Live,Check Website,High,IndiaAI,https://indiaai.gov.in/learning,06-Jun-2026 23:45:13
IndiaAI Event: DatasetsCurated sets of data to aid research initiatives,Government,Online,Live,Check Website,High,IndiaAI,https://indiaai.gov.in/datasets,06-Jun-2026 23:45:13
IndiaAI Event: Metadata and Data StandardsFor standardisation of data elements for AI research & innovation,Government,Online,Live,Check Website,High,IndiaAI,https://indiaai.gov.in/metadata-data-standards,06-Jun-2026 23:45:13
MeitY Official Portal,Government,Online,Live,Check Website,High,MeitY,https://www.meity.gov.in/,06-Jun-2026 23:46:26
Internet Radar: OpenAI News and Product Updates,Internet Update,Online,Live,Free,High,OpenAI News,https://openai.com/news/,07-Jun-2026 00:29:55
Internet Radar: Google AI Blog and Gemini Updates,Internet Update,Online,Live,Free,High,Google AI Blog,https://blog.google/technology/ai/,07-Jun-2026 00:29:55
Internet Radar: Microsoft AI Blog and Copilot Updates,Internet Update,Online,Live,Free,High,Microsoft AI Blog,https://blogs.microsoft.com/ai/,07-Jun-2026 00:29:55
Internet Radar: NVIDIA Generative AI Blog Updates,Internet Update,Online,Live,Free,High,NVIDIA AI Blog,https://blogs.nvidia.com/blog/category/generative-ai/,07-Jun-2026 00:29:55
Internet Radar: AWS Machine Learning Blog Updates,Internet Update,Online,Live,Free,High,AWS ML Blog,https://aws.amazon.com/blogs/machine-learning/,07-Jun-2026 00:29:55
Internet Radar: Hugging Face Blog and Model Updates,Internet Update,Online,Live,Free,High,Hugging Face,https://huggingface.co/blog,07-Jun-2026 00:29:55
Internet Radar: GitHub Trending AI Projects,Internet Update,Online,Live,Free,High,GitHub Trending,https://github.com/trending/python?since=daily,07-Jun-2026 00:29:55
Internet Radar: Kaggle AI Competitions,Hackathon,Online,Live,Free,High,Kaggle,https://www.kaggle.com/competitions,07-Jun-2026 00:29:55
Internet Radar: Product Hunt AI Tools and Launches,Tool Update,Online,Live,Free,Medium,Product Hunt,https://www.producthunt.com/topics/artificial-intelligence,07-Jun-2026 00:29:55
AI Jobs Radar: Generative AI Jobs on LinkedIn,Jobs,Online,Live,Free,High,LinkedIn Jobs,https://www.linkedin.com/jobs/search/?keywords=Generative%20AI,07-Jun-2026 01:31:22
AI Jobs Radar: Agentic AI Jobs on LinkedIn,Jobs,Online,Live,Free,High,LinkedIn Jobs,https://www.linkedin.com/jobs/search/?keywords=Agentic%20AI,07-Jun-2026 01:31:22
AI Jobs Radar: AI Engineer Jobs on Naukri,Jobs,Online,Live,Free,High,Naukri,https://www.naukri.com/artificial-intelligence-jobs,07-Jun-2026 01:31:22
AI Jobs Radar: Prompt Engineer Jobs,Jobs,Online,Live,Free,Medium,LinkedIn Jobs,https://www.linkedin.com/jobs/search/?keywords=Prompt%20Engineer,07-Jun-2026 01:31:22
AI Jobs Radar: AI Product Manager Jobs,Jobs,Online,Live,Free,Medium,LinkedIn Jobs,https://www.linkedin.com/jobs/search/?keywords=AI%20Product%20Manager,07-Jun-2026 01:31:22
AI Jobs Radar: AI Automation Jobs,Jobs,Online,Live,Free,High,Indeed,https://www.indeed.com/jobs?q=AI+Automation,07-Jun-2026 01:31:22
AI Sources Hub: OpenAI News and Releases,AI News,Online,Live,Free,High,OpenAI,https://openai.com/news/,07-Jun-2026 11:23:28
AI Sources Hub: Anthropic News and Claude Updates,AI News,Online,Live,Free,High,Anthropic,https://www.anthropic.com/news,07-Jun-2026 11:23:28
AI Sources Hub: Google AI and Gemini Updates,AI News,Online,Live,Free,High,Google AI,https://blog.google/technology/ai/,07-Jun-2026 11:23:28
AI Sources Hub: Microsoft AI and Copilot Updates,AI News,Online,Live,Free,High,Microsoft AI,https://blogs.microsoft.com/ai/,07-Jun-2026 11:23:28
AI Sources Hub: NVIDIA AI Blog and GTC Updates,AI News,Online,Live,Free,High,NVIDIA AI,https://blogs.nvidia.com/blog/category/ai/,07-Jun-2026 11:23:28
AI Sources Hub: AWS Machine Learning Blog,AI News,Online,Live,Free,High,AWS AI,https://aws.amazon.com/blogs/machine-learning/,07-Jun-2026 11:23:28
AI Sources Hub: Meta AI Blog,AI News,Online,Live,Free,High,Meta AI,https://ai.meta.com/blog/,07-Jun-2026 11:23:28
AI Sources Hub: Hugging Face Blog and Model Updates,AI News,Online,Live,Free,High,Hugging Face,https://huggingface.co/blog,07-Jun-2026 11:23:28
AI Sources Hub: LangChain Agentic AI Updates,Agentic AI,Online,Live,Free,High,LangChain,https://blog.langchain.dev/,07-Jun-2026 11:23:28
AI Sources Hub: CrewAI Agentic AI Platform Updates,Agentic AI,Online,Live,Free,High,CrewAI,https://www.crewai.com/,07-Jun-2026 11:23:28
AI Sources Hub: Microsoft AutoGen Multi-Agent Framework,Agentic AI,Online,Live,Free,High,Microsoft AutoGen,https://microsoft.github.io/autogen/,07-Jun-2026 11:23:28
AI Sources Hub: GitHub Trending AI Projects,AI Tools,Online,Live,Free,High,GitHub,https://github.com/trending/python?since=daily,07-Jun-2026 11:23:28
AI Sources Hub: Product Hunt AI Tools,AI Tools,Online,Live,Free,Medium,Product Hunt,https://www.producthunt.com/topics/artificial-intelligence,07-Jun-2026 11:23:28
AI Sources Hub: DeepLearning.AI Courses and Events,AI Learning,Online,Live,Check Website,High,DeepLearning.AI,https://www.deeplearning.ai/,07-Jun-2026 11:23:28
AI Sources Hub: Krish Naik AI YouTube Learning Channel,AI Influencer,Online,Live,Free,Medium,Krish Naik,https://www.youtube.com/@krishnaik06,07-Jun-2026 11:23:28
AI Sources Hub: Matt Wolfe AI Tools YouTube Channel,AI Influencer,Online,Live,Free,Medium,Matt Wolfe,https://www.youtube.com/@mreflow,07-Jun-2026 11:23:28
AI Release Notes Radar: OpenAI Product and Model Release Notes,AI Release Notes,Online,Live,Free,High,OpenAI,https://openai.com/news/,07-Jun-2026 11:51:07
AI Release Notes Radar: OpenAI API and Platform Updates,AI Release Notes,Online,Live,Free,High,OpenAI Platform,https://platform.openai.com/docs/changelog,07-Jun-2026 11:51:07
AI Release Notes Radar: Anthropic Claude Release Notes,AI Release Notes,Online,Live,Free,High,Anthropic,https://docs.anthropic.com/en/release-notes/overview,07-Jun-2026 11:51:07
AI Release Notes Radar: Google Gemini Release Notes,AI Release Notes,Online,Live,Free,High,Google Gemini,https://ai.google.dev/gemini-api/docs/changelog,07-Jun-2026 11:51:07
AI Release Notes Radar: Microsoft Azure AI Release Notes,AI Release Notes,Online,Live,Free,High,Microsoft Azure AI,https://learn.microsoft.com/azure/ai-services/whats-new,07-Jun-2026 11:51:07
AI Release Notes Radar: NVIDIA AI Enterprise Release Notes,AI Release Notes,Online,Live,Free,High,NVIDIA,https://docs.nvidia.com/ai-enterprise/release-notes/,07-Jun-2026 11:51:07
AI Release Notes Radar: Hugging Face Transformers Release Notes,AI Release Notes,Online,Live,Free,Medium,Hugging Face,https://github.com/huggingface/transformers/releases,07-Jun-2026 11:51:07
AI Release Notes Radar: LangChain Release Notes,Agentic AI Release Notes,Online,Live,Free,High,LangChain,https://changelog.langchain.com/,07-Jun-2026 11:51:07
AI Release Notes Radar: LangGraph Release Notes,Agentic AI Release Notes,Online,Live,Free,High,LangGraph,https://github.com/langchain-ai/langgraph/releases,07-Jun-2026 11:51:07
AI Release Notes Radar: CrewAI Release Notes,Agentic AI Release Notes,Online,Live,Free,High,CrewAI,https://github.com/crewAIInc/crewAI/releases,07-Jun-2026 11:51:07
AI Release Notes Radar: Microsoft AutoGen Release Notes,Agentic AI Release Notes,Online,Live,Free,High,Microsoft AutoGen,https://github.com/microsoft/autogen/releases,07-Jun-2026 11:51:07
AI Release Notes Radar: LlamaIndex Release Notes,Agentic AI Release Notes,Online,Live,Free,Medium,LlamaIndex,https://github.com/run-llama/llama_index/releases,07-Jun-2026 11:51:07
AI News Radar: OpenAI News and Announcements,AI News,Online,Live,Free,High,OpenAI,https://openai.com/news/,07-Jun-2026 12:07:30
AI News Radar: Anthropic News,AI News,Online,Live,Free,High,Anthropic,https://www.anthropic.com/news,07-Jun-2026 12:07:30
AI News Radar: Google AI Blog,AI News,Online,Live,Free,High,Google AI,https://blog.google/technology/ai/,07-Jun-2026 12:07:30
AI News Radar: Microsoft AI Blog,AI News,Online,Live,Free,High,Microsoft AI,https://blogs.microsoft.com/ai/,07-Jun-2026 12:07:30
AI News Radar: NVIDIA AI Blog,AI News,Online,Live,Free,High,NVIDIA,https://blogs.nvidia.com/blog/category/ai/,07-Jun-2026 12:07:30
AI News Radar: Meta AI News,AI News,Online,Live,Free,Medium,Meta AI,https://ai.meta.com/blog/,07-Jun-2026 12:07:30
AI News Radar: Hugging Face Blog,AI News,Online,Live,Free,High,Hugging Face,https://huggingface.co/blog,07-Jun-2026 12:07:30
AI News Radar: LangChain Blog,Agentic AI News,Online,Live,Free,High,LangChain,https://blog.langchain.dev/,07-Jun-2026 12:07:30
AI News Radar: CrewAI Blog,Agentic AI News,Online,Live,Free,High,CrewAI,https://www.crewai.com/blog,07-Jun-2026 12:07:30
AI News Radar: IndiaAI Mission Updates,India AI News,Online,Live,Free,High,IndiaAI,https://indiaai.gov.in,07-Jun-2026 12:07:30
AI News Radar: MeitY AI Announcements,India AI News,Online,Live,Free,High,MeitY,https://www.meity.gov.in,07-Jun-2026 12:07:30
AI News Radar: Digital India AI Updates,India AI News,Online,Live,Free,High,Digital India,https://www.digitalindia.gov.in,07-Jun-2026 12:07:30
AI News Radar: Startup India AI and Innovation Updates,India AI News,Online,Live,Free,Medium,Startup India,https://www.startupindia.gov.in,07-Jun-2026 12:07:30
AI News Radar: NASSCOM AI Updates,India AI News,Online,Live,Free,High,NASSCOM,https://nasscom.in,07-Jun-2026 12:07:30
AI News Radar: Analytics India Magazine,India AI News,Online,Live,Free,High,AIM,https://analyticsindiamag.com,07-Jun-2026 12:07:30
AI News Radar: MachineHack AI Community,India AI News,Online,Live,Freemium,Medium,MachineHack,https://machinehack.com,07-Jun-2026 12:07:30
AI News Radar: YourStory AI,India AI News,Online,Live,Free,Medium,YourStory,https://yourstory.com/tag/artificial-intelligence,07-Jun-2026 12:07:30
AI News Radar: Inc42 AI News,India AI News,Online,Live,Freemium,Medium,Inc42,https://inc42.com/artificial-intelligence,07-Jun-2026 12:07:30
AI News Radar: Krish Naik AI Updates,AI Creator News,Online,Live,Freemium,High,Krish Naik,https://krishnaik.in,07-Jun-2026 12:07:30
AI News Radar: Krish Naik YouTube Channel,AI Creator News,Online,Live,Free,High,Krish Naik YouTube,https://www.youtube.com/@krishnaik06,07-Jun-2026 12:07:30
AI News Radar: CampusX AI Learning Updates,AI Creator News,Online,Live,Free,Medium,CampusX,https://www.youtube.com/@campusx-official,07-Jun-2026 12:07:30
AI News Radar: Codebasics AI Updates,AI Creator News,Online,Live,Freemium,Medium,Codebasics,https://codebasics.io,07-Jun-2026 12:07:30
AI News Radar: Codebasics YouTube Channel,AI Creator News,Online,Live,Free,Medium,Codebasics YouTube,https://www.youtube.com/@codebasics,07-Jun-2026 12:07:30
